<?xml version="1.0" encoding="UTF-8"?>
<environment xmlns:xsi="http://www.w3.org/2001/XMLSchema-instance" 
	xsi:noNamespaceSchemaLocation="../../simulator/schemas/resources/DCwormsResSchema.xsd">
	
	<!-- Data Center description with energy parameters -->
	<resources>
		<computingResource class="DataCenter" name="dataCenter">
			<!-- Defined data center contains only 1 rack (if count attribute is not specified a default value=1 is assumed) -->
			<computingResource class="Rack">
				<!-- Rack consists of 4 computing nodes, 2 of one type and 2 of another -->
				<computingResource class="Node" count="2">
					<profile>
						<!-- Definition of computing node power profile -->
						<powerProfile>
							<!-- Reference to energy usage estimation plugin -->
							<energyEstimationPlugin>
								<name>example.energy.ComputingNodeEnergyEstimationPlugin</name>
							</energyEstimationPlugin>
							<!-- Definition of supported power states and corresponding power consumption -->	
							<!-- Units according to the user interpretation, however statistics chart generator module by default express the values in Watts -->
							<powerStates>
								<powerState>
									<name>ON</name>
									<powerUsage>250</powerUsage>
								</powerState>
								<powerState>
									<name>OFF</name>
									<powerUsage>0</powerUsage>
								</powerState>
							</powerStates>				
						</powerProfile>
					</profile>
					<!-- Each of 2 computing nodes contains 4 processors-->
					<computingResource class="Processor" count="4">
						<profile>
							<!-- Definition of processor power profile -->
							<powerProfile>
								<!-- Reference to energy usage estimation plugin -->
								<energyEstimationPlugin>
									<name>example.energy.CPUEnergyEstimationPlugin</name>
								</energyEstimationPlugin>		
								<!-- Definition of supported p-states and corresponding frequency and voltage level and power consumption -->
								<!-- Units according to the user interpretation, however, as far as power usage is concerned, statistics chart generator module by default express the values in Watts -->
								<parameter name="pState">
									<property name="name">
										<value>P0</value>
									</property>	
									<property name="frequency">
										<value unit="Hz">3000</value>
									</property>		
									<property name="voltage">
										<value unit="V">0</value>
									</property>
									<property name="powerUsage">
										<value unit="W">200</value>
									</property>						
								</parameter>
								<parameter name="pState">
									<property name="name">
										<value>P1</value>
									</property>	
									<property name="frequency">
										<value unit="H`">2660</value>
									</property>		
									<property name="voltage">
										<value unit="V">0</value>
									</property>
									<property name="powerUsage">
										<value unit="W">160</value>
									</property>						
								</parameter>	
								<parameter name="pState">
									<property name="name">
										<value>P2</value>
									</property>	
									<property name="frequency">
										<value unit="H`">2330</value>
									</property>		
									<property name="voltage">
										<value unit="V">0</value>
									</property>
									<property name="powerUsage">
										<value unit="W">140</value>
									</property>						
								</parameter>
								<parameter name="pState">
									<property name="name">
										<value>P3</value>
									</property>	
									<property name="frequency">
										<value unit="H`">2000</value>
									</property>		
									<property name="voltage">
										<value unit="V">0</value>
									</property>
									<property name="powerUsage">
										<value unit="W">120</value>
									</property>						
								</parameter>								
							</powerProfile>
						</profile>
					</computingResource>
				</computingResource>	
				<computingResource class="Node" count="2">
					<profile>
						<!-- Definition of computing node power profile -->
						<powerProfile>
							<!-- Reference to energy usage estimation plugin -->
							<energyEstimationPlugin>
								<name>example.energy.ComputingNodeEnergyEstimationPlugin</name>
							</energyEstimationPlugin>	
							<!-- Definition of supported power states and corresponding power consumption -->
							<!-- Units according to the user interpretation, however statistics chart generator module by default express the values in Watts -->
							<powerStates>
								<powerState>
									<name>ON</name>
									<powerUsage>150</powerUsage>
								</powerState>
								<powerState>
									<name>OFF</name>
									<powerUsage>0</powerUsage>
								</powerState>
							</powerStates>				
						</powerProfile>
					</profile>
					<!-- Each of 2 computing nodes contains 4 processors-->
					<computingResource class="Processor" count="4">
						<profile>
							<!-- Definition of processor power profile -->
							<powerProfile>
								<!-- Reference to energy usage estimation plugin -->
								<energyEstimationPlugin>
									<name>example.energy.CPUEnergyEstimationPlugin</name>
								</energyEstimationPlugin>	
								<!-- Definition of supported p-states and corresponding frequency and voltage level and power consumption -->
								<!-- Units according to the user interpretation, however, as far as power usage is concerned, statistics chart generator module by default express the values in Watts -->
								<parameter name="pState">
									<property name="name">
										<value>P0</value>
									</property>	
									<property name="frequency">
										<value unit="Hz">2000</value>
									</property>		
									<property name="voltage">
										<value unit="V">0</value>
									</property>
									<property name="powerUsage">
										<value unit="W">110</value>
									</property>						
								</parameter>
								<parameter name="pState">
									<property name="name">
										<value>P1</value>
									</property>	
									<property name="frequency">
										<value unit="H`">1800</value>
									</property>		
									<property name="voltage">
										<value unit="V">0</value>
									</property>
									<property name="powerUsage">
										<value unit="W">80</value>
									</property>						
								</parameter>	
								<parameter name="pState">
									<property name="name">
										<value>P2</value>
									</property>	
									<property name="frequency">
										<value unit="H`">1600</value>
									</property>		
									<property name="voltage">
										<value unit="V">0</value>
									</property>
									<property name="powerUsage">
										<value unit="W">60</value>
									</property>						
								</parameter>
								<parameter name="pState">
									<property name="name">
										<value>P3</value>
									</property>	
									<property name="frequency">
										<value unit="H`">1400</value>
									</property>		
									<property name="voltage">
										<value unit="V">0</value>
									</property>
									<property name="powerUsage">
										<value unit="W">40</value>
									</property>						
								</parameter>								
							</powerProfile>
						</profile>
					</computingResource>
				</computingResource>	
			</computingResource>
		</computingResource>
		<scheduler class="Cluster" name="cluster">
			<!-- Definition of scheduling plugin at cluster level -->
			<!-- Switch between scheduling/power management plugins to observe the difference in power consumption -->
			<schedulingPlugin>
				<name>example.localplugin.FCFSBF_DFSClusterPlugin</name>  
				<!-- <name>example.localplugin.Cluster_FCFSBF_DFSPlugin</name>  -->
			</schedulingPlugin>
			<!-- Reference to managed resources - cluster manages resources belonging to the defined data center -->
			<managedComputingResources include="false">
				<resourceName>dataCenter</resourceName>
			</managedComputingResources>
		</scheduler>	
	</resources>

</environment>
