<?xml version="1.0" encoding="UTF-8"?>
<environment xmlns:xsi="http://www.w3.org/2001/XMLSchema-instance" 
	xsi:noNamespaceSchemaLocation="../../simulator/schemas/resources/DCWormsResSchema.xsd">
	
	<!-- Data Center description with energy parameters -->
	<resources>
		<computingResource class="DataCenter" name="myDataCenter">
			<!-- Data Center contains of 4 computing nodes belonging to two different classes (with different power consumption level)-->
			<computingResource class="ComputingNode" count="2">
				<!-- Defines the computing node category - information can be used by user to facilitate the resource management process within various plugins -->
				<parameter name="category">
					<value>A</value>
				</parameter>
				<profile>
					<!-- Definition of computing node power profile -->
					<powerProfile>
						<!-- Reference to energy usage estimation plugin -->
						<energyEstimationPlugin>
							<name>plugins.energy.ComputingNodeEnergyEstimationPlugin</name>
						</energyEstimationPlugin>	
						<!-- Definition of supported power states and corresponding power consumption -->	
						<!-- Units according to the user interpretation, however statistics chart generator module by default express the values in Watts -->
						<powerStates>
							<powerState>
								<name>ON</name>
								<powerUsage>750</powerUsage>
							</powerState>
							<powerState>
								<name>OFF</name>
								<powerUsage>0</powerUsage>
							</powerState>
						</powerStates>				
					</powerProfile>
				</profile>
				<!-- Each of 2 computing nodes contains 4 processors-->
				<computingResource class="Processor" count="4">
				</computingResource>
			</computingResource>	
			<computingResource class="ComputingNode" count="2">
				<!-- Defines the computing node category - information can be used by user to facilitate the resource management process within various plugins -->
				<parameter name="category">
					<value>B</value>
				</parameter>
				<profile>
					<!-- Definition of computing node power profile -->
					<powerProfile>
						<!-- Reference to energy usage estimation plugin -->
						<energyEstimationPlugin>
							<name>plugins.energy.ComputingNodeEnergyEstimationPlugin</name>
						</energyEstimationPlugin>
						<!-- Definition of supported power states and corresponding power consumption -->	
						<!-- Units according to the user interpretation, however statistics chart generator module by default express the values in Watts -->	
						<powerStates>
							<powerState>
								<name>ON</name>
								<powerUsage>850</powerUsage>
							</powerState>
							<powerState>
								<name>OFF</name>
								<powerUsage>0</powerUsage>
							</powerState>
						</powerStates>				
					</powerProfile>
				</profile>
				<!-- Each of 2 computing nodes contains 4 processors-->
				<computingResource class="Processor" count="4">
				</computingResource>
			</computingResource>	
		</computingResource>
		<scheduler class="Cluster" name="cluster">
			<!-- Definition of scheduling plugin at cluster level -->
			<!-- Switch between scheduling/power management plugins to observe the difference in power consumption -->
			<schedulingPlugin>
				<name>plugins.localplugin.FCFSBF_NodePowerManagementClusterPlugin</name>
			</schedulingPlugin>	
			<!-- Reference to managed resources - cluster manages resources belonging to the defined data center -->
			<managedComputingResources include="false">
				<resourceName>myDataCenter</resourceName>
			</managedComputingResources>
		</scheduler>	
	</resources>

</environment>
